{"schema_version":"1.0","evaluation_receipt_id":"LS-AUTH-EVAL-ALLOW-001","profile_ref":"LS-AUTHORITY-PROFILE-FIXTURE-BOUND","profile_sha256":"bbbbbbbbbbbbbbbbbbbbbbbbbbbbbbbbbbbbbbbbbbbbbbbbbbbbbbbbbbbbbbbb","actor_id":"USER-ADMIN-1","verified_issuer":"https://idp.example.invalid","requested_action":"SUBMIT_SOURCE_EVIDENCE_DELTA","sku_id":"SKU-1","matched_roles":["PASSPORT_ADMIN"],"scope_match":true,"verdict":"AUTHORIZED","reason_code":"AUTHORIZED","evaluated_at":"2026-10-04T12:00:00Z","mutation_executed":false}
