{"schema_version":"1.0","evaluation_receipt_id":"LS-AUTH-EVAL-DENY-SCOPE","profile_ref":"LS-AUTHORITY-PROFILE-FIXTURE-BOUND","profile_sha256":"bbbbbbbbbbbbbbbbbbbbbbbbbbbbbbbbbbbbbbbbbbbbbbbbbbbbbbbbbbbbbbbb","actor_id":"USER-OWNER-1","verified_issuer":"https://idp.example.invalid","requested_action":"SUBMIT_SOURCE_EVIDENCE_DELTA","sku_id":"SKU-OUTSIDE-SCOPE","matched_roles":["PRODUCT_OWNER"],"scope_match":false,"verdict":"DENIED","reason_code":"SKU_SCOPE_DENIED","evaluated_at":"2026-10-04T12:02:00Z","mutation_executed":false}
