{"schema_version":"1.0","evaluation_receipt_id":"LS-AUTH-EVAL-DENY-UNMAPPED","profile_ref":"LS-AUTHORITY-PROFILE-FIXTURE-BOUND","profile_sha256":"bbbbbbbbbbbbbbbbbbbbbbbbbbbbbbbbbbbbbbbbbbbbbbbbbbbbbbbbbbbbbbbb","actor_id":"USER-UNKNOWN","verified_issuer":"https://idp.example.invalid","requested_action":"RECREATE_PASSPORT","sku_id":"SKU-1","matched_roles":[],"scope_match":false,"verdict":"DENIED","reason_code":"AUTHORITY_NOT_MAPPED","evaluated_at":"2026-10-04T12:01:00Z","mutation_executed":false}
